{
  "id": "topic_5413552",
  "title": "loOkas",
  "author": "loOkas",
  "created_time": "September 14, 2022, 01:09:16 PM",
  "content": "Как можно совместить?",
  "score": 0,
  "upvotes": 0,
  "downvotes": 0,
  "url": "https://bitcointalk.org/index.php?topic=5413552",
  "comments": [
    {
      "author": "andy_pelevin",
      "created_time": "September 15, 2022, 03:20:07 PMLast edit: September 15, 2022, 03:59:56 PM by andy_pelevin",
      "body": "Quote from: loOkas on September 14, 2022, 01:09:16 PMКак можно совместить?В какой то степкни, все блокчейны уже содержат в себе элементы IPFS. Во всех поиск информации делается не по названию, а по хэшу и инфа хранится в блоках. Хранить большие объёмы информации в блокчейне - дорогое удовольствие, кроме тех случаев, когда блокчен сделан специально для хранения информации. Такой блокчейн уже существует, это Filecoin. Я не знаю, как конкретно он устроен, но по идее, он, как раз, должен строиться по принципам межплатформенной файловой системы + функция шифрования.",
      "score": 0,
      "upvotes": 0,
      "downvotes": 0
    },
    {
      "author": "alex_sysadm",
      "created_time": "September 15, 2022, 04:44:19 PM",
      "body": "Вот здесь я как раз этим занимаюсь:https://bitcointalk.org/index.php?topic=5404396.0",
      "score": 0,
      "upvotes": 0,
      "downvotes": 0
    },
    {
      "author": "loOkas",
      "created_time": "September 16, 2022, 01:11:12 PMLast edit: September 16, 2022, 01:47:03 PM by Xal0lex",
      "body": "Quote from: andy_pelevin on September 15, 2022, 03:20:07 PMQuote from: loOkas on September 14, 2022, 01:09:16 PMКак можно совместить?В какой то степкни, все блокчейны уже содержат в себе элементы IPFS. Во всех поиск информации делается не по названию, а по хэшу и инфа хранится в блоках. Хранить большие объёмы информации в блокчейне - дорогое удовольствие, кроме тех случаев, когда блокчен сделан специально для хранения информации. Такой блокчейн уже существует, это Filecoin. Я не знаю, как конкретно он устроен, но по идее, он, как раз, должен строиться по принципам межплатформенной файловой системы + функция шифрования.В какой то степкни, все блокчейны уже содержат в себе элементы IPFS.Скорее — IPFS содержит в себе элементы блокчейнов.https://ipld.iohttps://github.com/multiformats/multicodec/blob/master/table.csvА так — да.Quote from: loOkas on September 14, 2022, 01:09:16 PMКак можно совместить?IPFS может стать частью OS системы, так чтобы с браузера загрузить OS.Quote from: alex_sysadm on September 15, 2022, 04:44:19 PMВот здесь я как раз этим занимаюсь:https://bitcointalk.org/index.php?topic=5404396.0Честно не понимаю, что делает данный проект и в чем ценность его. IPFS + токены.",
      "score": 0,
      "upvotes": 0,
      "downvotes": 0
    }
  ]
}